{
  "canonical_inputs": [
    "docs/meta/knowledge/DECISION_RUNTIME_MODEL.md",
    "generated/knowledge/review-decision.json",
    "generated/skills/skill-registry.json"
  ],
  "diff_range": "3aa40a42819d5108218c802b22346c63364317f9...HEAD",
  "escalation_reviewers": [
    "docs",
    "governance",
    "platform"
  ],
  "generated_by": "tools/knowledge/build_reviewer_obligations.py",
  "optional_reviewers": [],
  "pack_id": "reviewer-obligations",
  "required_reviewer_groups": [
    "docs",
    "governance",
    "platform"
  ],
  "reviewer_justifications": [
    {
      "blocking": true,
      "reason": "docs is required because control-plane-validation, docs-truth-review selects this reviewer in the canonical skill registry",
      "required_by_skills": [
        "control-plane-validation",
        "docs-truth-review"
      ],
      "reviewer": "docs"
    },
    {
      "blocking": true,
      "reason": "governance is required because docs-truth-review selects this reviewer in the canonical skill registry",
      "required_by_skills": [
        "docs-truth-review"
      ],
      "reviewer": "governance"
    },
    {
      "blocking": true,
      "reason": "platform is required because control-plane-validation selects this reviewer in the canonical skill registry",
      "required_by_skills": [
        "control-plane-validation"
      ],
      "reviewer": "platform"
    }
  ],
  "schema_version": 1,
  "source_range": "3aa40a42819d5108218c802b22346c63364317f9...HEAD"
}
